{
  "vendor": "ExampleVendor",
  "assessment_id": "1234",
  "organisation": "EURONEXT NV",
  "template_name": "Infosec Form (v14)",
  "date_created": "01/05/2026",
  "date_completed": "20/05/2026",
  "analyst": "F. Gomes",
  "analyst_decision": "Approved",
  "manager": "P. Santos",
  "manager_decision": "Approved",
  "dora_in_scope": true,
  "critical_supplier": false,
  "service_criticality": "Standard",
  "supplier_type": "Technology",
  "certifications": "ISO 27001 - Valid & in scope",
  "cert_valid": true,
  "approval_status": "Approved (Conditional)",
  "risks": [
    {
      "rid": "R01",
      "desc": "Inherent risk 1 - OneTrust v14 taxonomy item.",
      "category": "Security",
      "domain": "Cybersecurity",
      "inherent": 6.0,
      "residual": 0.0,
      "target": 4.0,
      "stage": "Treated",
      "controls": [
        {
          "id": "Euronext-TPRM-01",
          "status": "Pending"
        }
      ]
    },
    {
      "rid": "R02",
      "desc": "Inherent risk 2 - OneTrust v14 taxonomy item.",
      "category": "Security",
      "domain": "Cybersecurity",
      "inherent": 6.0,
      "residual": 0.0,
      "target": 4.0,
      "stage": "Treated",
      "controls": [
        {
          "id": "Euronext-TPRM-02",
          "status": "Implemented"
        }
      ]
    }
  ],
  "findings": [
    "Six controls treated; nine in treatment; one open risk.",
    "DORA in-scope - Art. 28-30 contractual actions required.",
    "Residual scores absent - inherent proxy applied."
  ],
  "perimeter": {
    "Cybersecurity": {
      "external": "Mitigated",
      "internal": "Treatment plan pending"
    },
    "Data Management": {
      "external": "Mitigated",
      "internal": "Treatment plan pending"
    },
    "IT": {
      "external": "Mitigated",
      "internal": "Treatment plan pending"
    },
    "Business Continuity": {
      "external": "Mitigated",
      "internal": "Treatment plan pending"
    },
    "Third-Parties": {
      "external": "Mitigated",
      "internal": "Treatment plan pending"
    }
  },
  "crit_findings": [
    [
      "Pending Euronext controls",
      "Internal treatment plans not yet closed.",
      false
    ],
    [
      "Overall MEDIUM",
      "Max residual sits in the MEDIUM band.",
      false
    ],
    [
      "Vendor posture adequate",
      "External perimeter fully certified.",
      true
    ],
    [
      "Conditional approval",
      "Go-live gated on TPOPS finalisation.",
      false
    ]
  ],
  "dora_actions": [
    [
      "IMMEDIATE",
      "Finalise the TPOPS contractual addendum."
    ],
    [
      "Q2 2026",
      "Update the DORA Register of Information."
    ],
    [
      "Q2 2026",
      "Close pending Euronext internal controls."
    ],
    [
      "ONGOING",
      "Apply quarterly residual review cadence."
    ],
    [
      "GOVERNANCE",
      "Annual reassessment per Art. 28-30."
    ]
  ],
  "analyst_notes": []
}